{
  "schemaVersion": 1,
  "kind": "movement-profile",
  "id": "default-hunter",
  "displayName": "Default Hunter Movement",
  "ground": {
    "walkSpeed": 2.5,
    "runSpeed": 5.5,
    "sprintSpeed": 7.5,
    "acceleration": 18,
    "deceleration": 24,
    "rotationSpeedDegrees": 720,
    "orientationMode": "camera_relative"
  },
  "stamina": {
    "maximum": 100,
    "sprintCostPerSecond": 12,
    "regenerationPerSecond": 18,
    "regenerationDelaySeconds": 0.75,
    "minimumToStartSprint": 8
  },
  "dodge": {
    "distance": 4.2,
    "durationSeconds": 0.55,
    "staminaCost": 20,
    "invulnerabilityStartSeconds": 0.08,
    "invulnerabilityEndSeconds": 0.32,
    "directionMode": "movement_input",
    "steeringMultiplier": 0.15
  }
}
